{
  "schemaVersion": 1,
  "lessonId": "M01-L003",
  "sourceScript": "M01-L003-script-master.json",
  "canvas": {
    "width": 1920,
    "height": 1080,
    "leftTeachingFraction": 0.6667,
    "rightCameraFraction": 0.3333,
    "safeZoneLabel": "Right third reserved for recording / camera"
  },
  "theme": {
    "id": "thai-nine-canva-bridge-v1",
    "name": "Canva Bridge Deck",
    "thaiFont": "Sarabun",
    "latinFont": "Sarabun",
    "backgroundColor": "#F5F7F8",
    "rightZoneTint": "#DBE7EC",
    "accentColors": [
      "#355C7D",
      "#7A8F54",
      "#C96F4A"
    ]
  },
  "slides": [
    {
      "id": "slide-01-opener",
      "role": "opener",
      "title": "Pronouns and Who Questions: Identify People in Simple Thai",
      "estimatedSeconds": 12,
      "layout": "lesson-opener",
      "speakerNotes": [
        "Open with the moment when someone points at another person and the learner needs to ask who that person is.",
        "Use basic pronouns, introduce another person with คือ, and ask who someone is in a short controlled exchange."
      ],
      "textBlocks": [
        {
          "id": "opener-focus",
          "kind": "bullet-list",
          "heading": "Lesson focus",
          "lines": [
            "Learner can use basic pronouns and ask who someone is.",
            "Point, identify, and ask who someone is in a mini-dialogue."
          ]
        }
      ],
      "thaiFocus": [],
      "visualStrategy": {
        "onScreenGoal": "Introduce the lesson clearly and set the recording tone.",
        "teachingVisuals": [
          "Pronouns and Who Questions: Identify People in Simple Thai",
          "First Contact and Courtesy"
        ],
        "teacherCues": [
          "Use the deck title as the recording opener.",
          "Keep the right third clear."
        ],
        "imageUsage": "text-only",
        "rationale": "The opener should establish identity and objective without visual clutter."
      },
      "assets": []
    },
    {
      "id": "slide-02-objectives",
      "role": "objectives",
      "title": "What you will learn",
      "estimatedSeconds": 16,
      "layout": "objectives-list",
      "speakerNotes": [
        "Learner can use basic pronouns and ask who someone is.",
        "Learner can recycle recent vocabulary while using identity question with ใคร in short controlled output.",
        "Point, identify, and ask who someone is in a mini-dialogue.",
        "Distinguish pronouns and who-questions in short exchanges."
      ],
      "textBlocks": [
        {
          "id": "objectives-list",
          "kind": "bullet-list",
          "heading": "Objectives",
          "lines": [
            "Learner can use basic pronouns and ask who someone is.",
            "Learner can recycle recent vocabulary while using identity question with ใคร in short controlled output.",
            "Point, identify, and ask who someone is in a mini-dialogue.",
            "Distinguish pronouns and who-questions in short exchanges."
          ]
        }
      ],
      "thaiFocus": [],
      "visualStrategy": {
        "onScreenGoal": "Make the lesson goals visible before the teaching slides begin.",
        "teachingVisuals": [
          "Learner can use basic pronouns and ask who someone is.",
          "Learner can recycle recent vocabulary while using identity question with ใคร in short controlled output.",
          "Point, identify, and ask who someone is in a mini-dialogue.",
          "Distinguish pronouns and who-questions in short exchanges."
        ],
        "teacherCues": [
          "Pause briefly after each objective.",
          "Keep the slide readable from a distance."
        ],
        "imageUsage": "text-only",
        "rationale": "Objectives are clearer as cards than as decorative visuals."
      },
      "assets": []
    },
    {
      "id": "slide-03-use-pronouns-as-practica",
      "role": "teaching",
      "title": "Use pronouns as practical speaker labels",
      "estimatedSeconds": 37,
      "layout": "contrast-board",
      "speakerNotes": [
        "Today we add a small set of pronouns, but we keep them practical. ฉัน chǎn and ผม phǒm are both ways to say I, while เขา khǎo points to another person as he or she.",
        "Thai beginners often try to memorise a long pronoun chart. That is not the goal here. The goal is to know which word helps you identify yourself and which word helps you refer to someone else.",
        "You already know the review question คุณชื่ออะไร khun chûue à-rai. Inside that full question, คุณ is the word for you, so the learner is already hearing pronouns in a useful pattern."
      ],
      "textBlocks": [
        {
          "id": "slide-03-use-pronouns-as-practica-triplets",
          "kind": "triplet-list",
          "heading": "Key language",
          "lines": [
            "ฉัน | chǎn | I",
            "ผม | phǒm | I (male speaker)",
            "เขา | khǎo | he / she",
            "คุณชื่ออะไร | khun chûue à-rai | what is your name?"
          ]
        },
        {
          "id": "slide-03-use-pronouns-as-practica-practice",
          "kind": "bullet-list",
          "heading": "Practice",
          "lines": [
            "Point-and-say drill: teacher points to self or another person and learner chooses ฉัน, ผม, or เขา aloud.",
            "Replacement drill: learner keeps the same sentence slot but swaps ฉัน / ผม / เขา depending on the speaker card."
          ]
        }
      ],
      "thaiFocus": [
        {
          "thai": "ฉัน",
          "translit": "chǎn",
          "english": "I"
        },
        {
          "thai": "ผม",
          "translit": "phǒm",
          "english": "I (male speaker)"
        },
        {
          "thai": "เขา",
          "translit": "khǎo",
          "english": "he / she"
        },
        {
          "thai": "คุณชื่ออะไร",
          "translit": "khun chûue à-rai",
          "english": "what is your name?"
        }
      ],
      "visualStrategy": {
        "onScreenGoal": "Show self-versus-other pronouns as usable speaking roles, anchored by one familiar review question.",
        "teachingVisuals": [
          "Three speaker chips for ฉัน, ผม, and เขา with simple role labels underneath.",
          "A review strip for คุณชื่ออะไร to show where คุณ naturally appears as you."
        ],
        "teacherCues": [
          "Keep the contrast practical: self versus another person, not a full grammar table.",
          "Reinforce that Thai often drops pronouns when context is obvious, but today we keep them visible for control."
        ],
        "imageUsage": "text-only",
        "rationale": "Pronoun contrast is clearer as speaker-role cards than as photographs."
      },
      "assets": []
    },
    {
      "id": "slide-04-use-to-introduce-and-ide",
      "role": "teaching",
      "title": "Use นี่คือ... to introduce and identify",
      "estimatedSeconds": 33,
      "layout": "dialogue-ladder",
      "speakerNotes": [
        "The next frame is นี่คือ... nîi kheuu.... A natural translation is this is ..., and Thai uses it to introduce a person or identify something in front of you.",
        "The high-frequency word คือ kheuu is doing a linking job here. It connects the person or thing you are talking about with the name or identity that comes after it.",
        "A common beginner mistake is to think คือ must always be translated word for word as is. It is better to hear the whole frame as an introducing pattern: นี่คือ..., เขาคือ..., or คุณคือ...ใช่ไหม."
      ],
      "textBlocks": [
        {
          "id": "slide-04-use-to-introduce-and-ide-triplets",
          "kind": "triplet-list",
          "heading": "Key language",
          "lines": [
            "นี่คือ... | nîi kheuu... | this is ...",
            "เขาคือ... | khǎo kheuu... | he / she is ...",
            "คุณคือ...ใช่ไหม | khun kheuu... châi mái | you are ... right?",
            "ไม่ใช่ | mâi châi | no / not right"
          ]
        },
        {
          "id": "slide-04-use-to-introduce-and-ide-practice",
          "kind": "bullet-list",
          "heading": "Practice",
          "lines": [
            "Introduction drill: teacher points to a photo card and learner says นี่คือ... with the supplied name or role.",
            "Confirmation drill: teacher says คุณคือ...ใช่ไหม and learner answers ใช่ or ไม่ใช่."
          ]
        }
      ],
      "thaiFocus": [
        {
          "thai": "นี่คือ...",
          "translit": "nîi kheuu...",
          "english": "this is ..."
        },
        {
          "thai": "เขาคือ...",
          "translit": "khǎo kheuu...",
          "english": "he / she is ..."
        },
        {
          "thai": "คุณคือ...ใช่ไหม",
          "translit": "khun kheuu... châi mái",
          "english": "you are ... right?"
        },
        {
          "thai": "ไม่ใช่",
          "translit": "mâi châi",
          "english": "no / not right"
        }
      ],
      "visualStrategy": {
        "onScreenGoal": "Make the linking job of คือ visible through short identity frames, not through dense grammar notes.",
        "teachingVisuals": [
          "A three-rung ladder: นี่คือ..., เขาคือ..., คุณคือ...ใช่ไหม.",
          "A small yes/no response chip showing ใช่ versus ไม่ใช่ after the confirmation question."
        ],
        "teacherCues": [
          "Describe คือ as a linking word with a job, not as a direct dictionary translation only.",
          "Keep the identity frame on screen while swapping only the final slot."
        ],
        "imageUsage": "real-image",
        "rationale": "A simple real-world social image helps the learner understand that นี่คือ... is used to introduce a person standing there, not only to label objects."
      },
      "assets": [
        {
          "assetId": "slide-04-use-to-introduce-and-ide-asset-1",
          "kind": "image",
          "query": "two people introducing a third person in classroom",
          "sourcePolicy": "internet-first",